{
  "doc": "Missing values: an empty field, NaN, NA, and -. Each becomes NaN.",
  "encoding": "utf8",
  "bom": false,
  "sep": "comma",
  "decimal": "point",
  "skip": 0,
  "comment": null,
  "header": 1,
  "columns": [
    {
      "label": "channel",
      "unit": null,
      "type": "number",
      "missing": 0
    },
    {
      "label": "value",
      "unit": null,
      "type": "number",
      "missing": 4
    }
  ],
  "rows": 24
}
